{
  "id": "uniswap",
  "chainId": 1,
  "governorAddress": "0x408ED6354d4973f66138C91495F2f2FCbd8724C3",
  "governorVersion": "bravo-v3",
  "votingToken": {
    "type": "ERC20VotesComp",
    "address": "0x1f9840a85d5aF5bf1D1762F925BDADdC4201F984",
    "symbol": "UNI",
    "decimals": 18
  },
  "timelock": {
    "address": "0x1a9C8182C09F50C8318d769245beA52c32BE35BC",
    "minDelay": 172800
  },
  "votingParams": {
    "votingDelay": 13140,
    "votingPeriod": 40320,
    "proposalThreshold": "1000000000000000000000000",
    "quorumNumerator": 4,
    "quorumDenominator": 100
  },
  "executor": {
    "type": "timelock",
    "id": null
  },
  "quorumCounting": "for",
  "explorer": {
    "etherscanBase": "https://etherscan.io",
    "tallyOrgSlug": "uniswap"
  },
  "notes": "Uniswap GovernorBravoDelegate (proxy). Bravo signatures: propose has signatures[], queue/execute take proposalId, quorum is fixed quorumVotes(), snapshot/deadline via proposals(uint256). ProposalState enum matches OZ canonical order. votingDelay/votingPeriod are in BLOCKS — this contract has no ERC-6372 clock(); clock() and CLOCK_MODE() both revert. quorumVotes() is a fixed value (40,000,000 UNI = 4% of the 1,000,000,000 UNI supply); quorumNumerator/Denominator here are descriptive only. Bravo has no COUNTING_MODE(); only For votes count toward quorum, hence quorumCounting 'for'. votingDelay/votingPeriod/proposalThreshold/timelock re-read from chain 1 at block 25955258 — do not copy these from research/ (the previously shipped timelock 0x1a9C8182C09F50355CeA8fFF4b7E1649A535498a has no code on mainnet)."
}
